4317, HUNTERS HALL, NR204JU, 52.7094996, 1.0017418, false
4320, READING MOAT HOUSE, RG415DF, 51.4247514, -0.8929881, false
4324, THE CRAYTHORNE, DE130AZ, 52.8392761, -1.6347031, false
4329, TOWN HALL, L207AE, 53.44577779999999, -2.994223, false
4333, TREREIFE, TR208TJ, 50.1123877, -5.565486, false
4345, TOWNELEY HALL, BB113RQ, 53.7740234, -2.2225832, false
4349, THE QUEENS CLUB LTD, W149EB, 51.48915909999999, -0.2128957, false
4352, THE PENTAHOTEL READING, RG17RH, 51.45482, -0.978141, false
4357, ROYAL NAVAL CLUB & ROYAL ALBERT YACHT CLUB, PO12NT, 50.7895779, -1.1020221, false
4360, EAST SUSSEX NATIONAL GOLF CLUB, TN225ES, 50.94148879999999, 0.0997813, false
4366, CUBLEY HALL, S369DF, 53.5155257, -1.6324911, false
4375, KIMBERLEY HALL, NR180RT, 52.60022379999999, 1.08542, false
4382, BLACKPOOL FOOTBALL CLUB, FY16JL, 53.8037654, -3.0462247, false
4385, THE BREWERY BY EC&O, EC1Y4SD, 51.52351420000001, -0.0917564, true
4390, SAXONHURST, PE109NE, 52.7682031, -0.3788978, false
4396, THE OXFORDSHIRE GOLF CLUB, OX92PU, 51.72806929999999, -1.0152561, false
4399, LINDEN HOUSE, PE111XP, 52.7866379, -0.1482115, false
4405, HOTEL FELIX, CB30LX, 52.22413230000001, 0.0919294, false
4409, FOUR CROSSES, SY38EF, 52.7240913, -2.8096994, false
4415, HEDINGHAM CASTLE, CO93DJ, 51.9926755, 0.6026678, false
4420, GILLINGHAM FOOTBALL CLUB, ME74DD, 51.3848727, 0.5597597, false
4425, BEST WESTERN PLUS MANOR HOTEL, CV77NH, 52.4350073, -1.6379203, false
4429, HENDON TOWN HALL, NW44BG, 51.58315229999999, -0.2298416, true
4432, THE TOWN HALL, SN101BN, 51.3511013, -1.9950685, false
4435, THE JUNGLE CLUB, LE45ER, 52.65841469999999, -1.1196363, false
4439, THE HOLIDAY INN, PL12HJ, 50.3671707, -4.141673000000001, false
4446, GLAZEBROOK HOUSE HOTEL, TQ109JE, 50.416681, -3.8460162, false
4450, MARWELL HALL, SO211JH, 50.9909475, -1.2795949, false
4454, THE CALEDONIAN HOTEL, NE22AT, 54.9906975, -1.6039709, false
4461, BURY LODGE, CM248QE, 51.8861561, 0.213334, false
4470, LLECHWEN HALL HOTEL, CF374HP, 51.6401882, -3.3090084, false
4476, MELLINGTON HALL HOTEL, SY157HX, 52.5557538, -3.0871736, true
4482, ARUNDELL ARMS HOTEL, PL160AA, 50.64323390000001, -4.2830185, false
4487, THE SWAN HOTEL, LA229RF, 54.4654634, -3.0201167, false
4496, STATHAM LODGE HOTEL, WA139BP, 53.3846084, -2.5003501, false
4502, THE OLD MARYLEBONE TOWN HALL, NW15PT, 51.5212083, -0.1599799, false
4505, THE STRATFORD, CV376QQ, 52.19405889999999, -1.712998, false
4511, THE AGEAS BOWL, SO303XH, 50.9234336, -1.3234343, false
4515, WILLESBOROUGH WINDMILL, TN240QG, 51.1423401, 0.9019068, false
4523, THE SLAUGHTERS COUNTRY INN, GL542HS, 51.9010292, -1.7625682, false
4528, CANOLFAN PENTRE IFAN, SA413XE, 52.00837910000001, -4.779860500000001, false
4532, BURLEIGH COURT, GL52PF, 51.71557079999999, -2.1932456, false
4536, THE ORWELL HOTEL, IP117DX, 51.9675222, 1.3535268, false
4542, KELMARSH HALL, NN69LY, 52.407649, -0.9177108999999999, false
4545, THE ROYAL HOTEL, PO381JJ, 50.594112, -1.2120314, false
4551, THE ELMS BARN, NR340EL, 52.4917458, 1.5932579, false
4557, HOLIDAY INN ASHFORD CENTRAL, TN248QQ, 51.1574655, 0.8805862999999999, false
4562, ELLESMERE PORT CIVIC HALL, CH650AZ, 53.27739159999999, -2.9032508, false
4570, CROSSWAYS HOTEL, BA44EU, 51.1723656, -2.6228986, false
4573, DUXFORD LODGE HOTEL, CB224RT, 52.08873, 0.1563873, false
4580, THE OSBORNE HOTEL, TQ12LL, 50.4581568, -3.5095778, false
4584, COLTSFOOT COUNTRY RETREAT, SG36SB, 51.8406118, -0.1575974, false
4588, FURZE HILL, CM40EW, 51.6923612, 0.4069497, false
4594, PARK INN NOTTINGHAM, NG52BT, 52.9701786, -1.1530593, false
4598, SAM'S OF SEVENDIALS, BN13TD, 50.8309941, -0.1465833, false
4604, WRANGHAM HOUSE HOTEL, YO14ONS, 54.18174459999999, -0.3197247, false
4608, HONOURABLE ARTILLERY COMPANY, EC1Y2BQ, 51.5229181, -0.08753269999999999, false
4612, BARNSLEY HOUSE, GL75EE, 51.74304000000001, -1.8912263, false
4617, KITS COTY BRASSERIE, ME207EZ, 51.3201063, 0.5058591, false
4620, RYLSTON, KT139LN, 51.3787192, -0.4332587, false
4623, HELENA THOMPSON MUSEUM, CA144DE, 54.6414419, -3.5383394, false
4626, BRANTWOOD, LA218AD, 54.34182070000001, -3.0660445, false
4631, THE GROUCHO CLUB, W1D4QB, 51.5132381, -0.1319238, false
4635, BAILBROOK HOUSE HOTEL, BA17JD, 51.4012465, -2.334417, false
4639, CARNGLAZE CAVERNS, PL146HQ, 50.4710463, -4.5538615, false
4644, ASHRIDGE, HP41NS, 51.799495, -0.5598413, false
4648, RAMADA DOVER, CT163EL, 51.1563601, 1.2862734, false
4655, HURLSTON HALL GOLF & COUNTRY CLUB, L408HB, 53.5887871, -2.9038519, false
4663, THE STAR AND EAGLE HOTEL, TN171AL, 51.11320449999999, 0.4597402, false
4666, HOTEL PRINCE REGENT, DT47NR, 50.6172651, -2.4518237, false
4670, HOMME HOUSE, HR82NJ, 51.9848323, -2.5071648, false
4674, KIMBOLTON CASTLE, PE280EA, 52.2952135, -0.3893314, false
4679, ORCHARDLEIGH HOUSE, TA112PA, 51.0544485, -2.6927905, true
4682, THE KENDLESHIRE, BS362UY, 51.5147565, -2.47048, false
4689, ST GILES ROOMS, NR21JR, 52.6294699, 1.2885044, false
4696, BRUISYARD HALL AND BARN, IP172EJ, 52.2445799, 1.4175477, false
4701, THE CLARION COLLECTION CROMWELL HOTEL, SG13AZ, 51.9127179, -0.2082258, false
4706, THE ROYAL SOCIETY FOR PUBLIC HEALTH, W1B1LY, 51.5195413, -0.1443503, false
4711, TAUNTON RACECOURSE, TA37BL, 50.9936781, -3.0826742, false
4718, SUNDRIDGE PARK MANOR, BR13FZ, 51.4177236, 0.0372683, false
4722, THE LIMESTONE CAVERNS, DY14SB, 52.5235753, -2.0751678, false
4725, UPWALTHAM BARNS,THE GRANARY, GU280LX, 50.9153296, -0.6598106, false
4732, WOKEFIELD MANSION HOUSE, RG73AE, 51.3858466, -1.0304208, false
4735, LAKEWOOD CONFERENCE CENTRE, BS407YE, 51.3244021, -2.7229762, false
4742, LLANVIHANGEL COURT, NP78DH, 51.8794663, -2.9808208, false
4748, THE BELL HOTEL, CO108NN, 52.0783056, 0.5810115, false
4753, SPIRELLA BALLROOM, SG64ET, 51.9800933, -0.2319965, false
4759, DEVONPORT HOUSE, SE109JW, 51.48067200000001, -0.007137499999999999, false
4762, CROWNE PLAZA LONDON-DOCKLANDS, E161AL, 51.5082788, 0.0202369, false
4768, HORSLEY LODGE, DE215BL, 52.9933956, -1.4341408, false
4773, PEAK EDGE HOTEL AT THE RED LION, S450LW, 53.1998721, -1.499569, false
4776, WINDY HARBOUR FARM HOTEL, SK137QE, 53.4595846, -1.9442664, false
4786, LAMBETH TOWN HALL, SW21RW, 51.460662, -0.1169552, false
4793, THE KING ARTHUR HOTEL, SA31AD, 51.58734459999999, -4.1947993, false
4797, BODYSGALLEN HALL, LL301RS, 53.2984632, -3.8065943, false
4804, WHITE HEATHER, LN82AT, 53.3946492, -0.5510783, false
4811, THE BIRCHES HOTEL & CONFERENCE CENTRE, PE316RH, 52.8721944, 0.6563093999999999, false
4814, REGENCY BANQUETING SUITE, N176UR, 51.5951584, -0.07071129999999999, false
4823, THE GROSVENOR HOTEL, TQ25HG, 50.4648484, -3.5370274, false
4827, GIBSON HALL, EC2N3BA, 51.51476049999999, -0.0835938, false
4830, SQUARE AND COMPASS, TA199NX, 50.94419509999999, -2.9837353, false
4833, THE WYNDHAM ARMS HOTEL, GL158JT, 51.7180985, -2.5955195, true
4841, LION QUAYS, SY113EN, 52.9136359, -3.0429029, false
4852, RAMADA HOTEL  ( THE CROWN SUITE), HA40HN, 51.5585134, -0.3942262, false
4855, CROSBY TOWN HALL, L221RB, 53.47227789999999, -3.0249594, false
4860, MORRELL HOUSE, EC2A3AF, 51.5249974, -0.0799493, false
4864, ST MAWES CASTLE, TR25AA, 50.1671887, -5.0167452, false
4868, MAPPERTON HOUSE GARDENS, DT83NR, 50.7946184, -2.7057874, false
4872, THE PRIORY HOTEL, LN119AJ, 53.3684693, 0.004091, false
4878, WOODLANDS MANOR GOLF CLUB, TN156AB, 51.322381, 0.2490188, false
4884, THE OAKWOOD CENTRE, RG54JD, 51.4544654, -0.9001711, false
4890, TOWER BRIDGE, SE12UP, 51.503378, -0.0765787, false
4896, HILTON LEICESTER, LE191WQ, 52.6006027, -1.1840779, false
4901, CROYDON PARK HOTEL, CR95AA, 51.3730951, -0.09106720000000001, false
4905, COMFORT HOTEL HARROW, HA12NT, 51.5810093, -0.3264638, false
4914, LYNCOMBE LODGE HOTEL, BS255PQ, 51.3303445, -2.8136097, false
4919, CAPE GOLF AND LEISURE, TR197NL, 50.1264889, -5.699792899999999, false
4929, TAWNY OWL, SN251WR, 51.5964925, -1.8244598, false
4934, DANSON HOUSE, DA68HL, 51.4557693, 0.1225786, false
4943, FRENSHAM POND HOTEL, GU102QB, 51.1521547, -0.7982621999999999, false
4954, THE RESTAURANT IN THE PARK, CV324WA, 52.3198148, -1.5076236, true
4961, KIRTLINGTON PARK, OX53JN, 51.874477, -1.2654662, false
4966, THE MARRIOTT HOTEL, PE26GB, 52.5499413, -0.3249183, false
4971, CORPORATION OF TRINITY HOUSE, EC3N4DH, 51.51042229999999, -0.07731969999999999, false
4974, EDDY'S RESTAURANT, SA31JD, 51.59618469999999, -4.2838383, false
4983, HAMPTON COURT HOUSE, KT99BS, 51.3674142, -0.3058465, false
4987, CONCORDE G-BOAC & CONCORDE HALL, WA158XQ, 53.3560962, -2.2845211, false
4990, BLENHEIM PALACE, OX201PS, 51.8413537, -1.3609484, false
4995, HACKNEY TOWN HALL, E81EA, 51.54503219999999, -0.0564343, false
4999, THE RIVIERA HOTEL, BH48JF, 50.7122715, -1.8998553, false
5007, DEINCOURT HOTEL, NG241TF, 53.0721315, -0.806406, false
5013, OX PASTURE HALL HOTEL, YO125TD, 54.2866904, -0.4587146, false
5016, BRIARS HALL HOTEL, L405TH, 53.5924949, -2.8235688, false
5020, PIKE AND EEL HOTEL, PE274TW, 52.32317099999999, -0.005989899999999999, false
5026, THE NOTTINGHAM UNIVERSITY CLUB, NG72RD, 52.9412501, -1.1864805, false
5032, RUSHTON HALL, NN141RR, 52.4364055, -0.7710066, false
5036, THE BEAR HOTEL, SN101HS, 51.3521803, -1.9964756, false
5042, THE VIP LOUNGE, HA87DD, 51.6100423, -0.2790074, false
5046, ST MARY'S HOUSE, BN443WE, 50.8827826, -0.3122821, false
5050, CLEY WINDMILL, NR257RP, 52.9543427, 1.0428333, false
5054, RIVERDALE HALL HOTEL, NE482JT, 55.1447424, -2.2644204, false
5060, LITTLE CHANNELS, CM33PR, 51.77897859999999, 0.4861206, false
5068, EGYPT MILL HOTEL, GL60AE, 51.697497, -2.2196608, false
5073, HARTINGTON HALL, SK170AT, 53.1399466, -1.8068363, false
5080, HARPER ADAMS UNIVERSITY COLLEGE, TF108NB, 52.7800041, -2.425381, false
5087, THE ARTS CLUB, W1S4NP, 51.50815970000001, -0.1422621, false
5093, THE MALTINGS, CB74BB, 52.3957227, 0.2683074, false
5097, WOLDINGHAM SCHOOL, CR37YA, 51.2763229, -0.051738, false
5100, ST AUGUSTINE'S PRIORY, TN257AU, 51.0858742, 0.9130505000000001, false
5106, LEWES CASTLE, BN71YE, 50.8727945, 0.0089079, false
5110, GOSFORTH CIVIC HALL, NE35HD, 55.0343737, -1.62485, false
5113, THE CURRADINE BARNS, WR66TS, 52.2789073, -2.2912413, false
5118, FEVERSHAM ARMS HOTEL, YO625AG, 54.2481425, -1.0645005, false
5123, THE HOTEL PENRALLT, SA432BS, 52.1226031, -4.5603237, false
5127, THE TOWN HALL, SA152AP, 51.6712273, -4.1472501, false
5136, GUILDHALL MUSEUM, ME11PY, 51.39109329999999, 0.50288, false
5146, HOLDFAST COTTAGE HOTEL, WR136NA, 52.06240099999999, -2.3115343, false
5151, THE CHICHESTER, SS118UE, 51.6047316, 0.5682109, false
5154, ETROP GRANGE HOTEL, M904EG, 53.3709774, -2.2747459, false
5162, PEASEHILL HOUSE HOTEL, LS196HJ, 53.85390719999999, -1.6842475, false
5166, THE OLD MILL HOTEL AND LEISURE CLUB, BL09DS, 53.65034199999999, -2.3232779, false
5171, MANOR HOUSE, DA146BW, 51.4242292, 0.1022299, false
5176, THE RACECOURSE NEWBURY, RG147NZ, 51.3970068, -1.3070304, false
5181, THE BAINBRIDGE SUITE, LN21NN, 53.2314136, -0.5367592, false
5185, HARLAXTON MANOR, NG321AG, 52.8805434, -0.6710492, false
5192, DODDINGTON HALL, LN64RU, 53.2195356, -0.6540053, false
5200, HOLIDAY INN FARNBOROUGH, GU146AZ, 51.2741231, -0.7557307999999999, false
5204, CHESHUNT MARRIOTT HOTEL, EN106NG, 51.7208218, -0.0324433, false
5210, ASHBOURNE HOTEL, DN403JL, 53.639103, -0.2707870000000001, false
5222, WELLSHURST GOLF & COUNTRY CLUB, BN274EE, 50.9100944, 0.2469807, false
5228, COUNTY ASSEMBLY ROOMS, LN13AR, 53.235791, -0.5381832, false
5234, BURGHLEY HOUSE, PE93JY, 52.6424828, -0.4524698, false
5237, CROWNE MORAN HOTEL, NW23ED, 51.556677, -0.2148523, false
5245, THE RACECOURSE, LL1H2AH, 0.0, 0.0, false
5248, OLD ROYAL NAVAL COLLEGE (THE PAINTED HALL), SE109LW, 51.4827725, -0.0090335, false
5251, BISHAM ABBEY NATIONAL SPORTS CENTRE, SL71RT, 51.5558657, -0.7808894, false
5256, CONISTON HALL, BD234EB, 53.9995043, -2.1715067, false
5259, JEREMY'S RESTAURANT, RH161XP, 51.0218365, -0.1131456, false
5264, HEALDS HALL HOTEL, WF156JA, 53.7112334, -1.6850281, false
5267, THE PILGRIM CENTRE, MK417PZ, 52.1499356, -0.4588327, false
5272, THE GUILDHALL, LE15FQ, 52.6348957, -1.1365841, false
5278, HOTEL RUSSELL, WC1B5BE, 51.5226334, -0.1250382, false
5282, KINGS HEAD HOTEL, DL104HS, 54.4036195, -1.7371792, false
5285, THE COUNCIL HOUSE, PO191LQ, 50.83726919999999, -0.7784603, false
5288, MINT LEAF, SW1Y5BA, 51.5082813, -0.1301091, false
5294, BICTON COLLEGE, EX97BY, 50.67027, -3.3166938, false
5298, HILTON NEWBURY CENTRE, RG147HL, 51.3821464, -1.318276, false
5304, FOUR SEASONS HOTEL, RG278TD, 51.2576996, -0.8904552, false
5315, MANSION HOUSE, WA102UE, 53.4628721, -2.743742, false
5318, QUEEN ANNE'S SCHOOL, RG46DX, 51.470606, -0.9684733, false
5324, ROCHDALE CRICKET,LACROSS & SQUASH CLUB, OL115BX, 53.6179517, -2.1750031, false
5327, EASTHAMPSTEAD PARK CONFERENCE CENTRE, RG403DF, 51.39881159999999, -0.7877567999999999, false
5333, NUTTERS RESTAURANT, OL127TT, 53.63191089999999, -2.2326914, false
5339, MARRIOTT WORSLEY PARK HOTEL, M282QT, 53.50538280000001, -2.3908946, false
5348, GREETHAM VALLEY GOLF CLUB, LE157NP, 52.7194821, -0.6219236, false
5353, CLIFF BARNS, PE321HZ, 52.68520239999999, 0.5938776, false
5362, PACKINGTON MOOR FARM, WS149QB, 52.6491053, -1.7829003, false
5374, THE ANGEL HOTEL, GU13DP, 51.2357568, -0.5732141, false
5380, WHATELY HALL HOTEL, OX160AN, 52.0608654, -1.3411352, false
5384, NORTON PARK HOTEL, SO213NB, 51.1633388, -1.3187164, false
5392, FORDE ABBEY  & GARDENS, TA204LU, 50.8433909, -2.9113206, false
5396, INN ON THE LAKE, KT111EF, 51.33509840000001, -0.4523029, false
5404, HAREWOOD HOUSE, LS179LQ, 53.9005291, -1.5126518, false
5408, THE ADMIRAL'S SUITE, EN26QQ, 51.6532609, -0.0862434, false
5412, ST DONATS CASTLE, CF611WF, 51.4023877, -3.5314816, false
5417, THE OLD HOUSE HOTEL, PO175JG, 50.8999737, -1.1869022, false
5421, LONGFORD HOUSE BEEFEATER GRILL, WS111SJ, 52.6799212, -2.0492564, false
5424, THE MANOR HOTEL, RM139EL, 51.5265332, 0.2259502, false
5432, LONDON MARRIOTT HOTEL WEST INDIA QUAY, E144ED, 51.5071078, -0.0213168, false
5440, THE CONNINGBROOK HOTEL, TN249QR, 51.1662923, 0.8968299999999999, false
5444, HIGH ELMS MANOR, WD250JX, 51.7019643, -0.3935957, false
5452, HOMEWOOD PARK HOTEL, BA27TB, 51.3363877, -2.3189006, false
5456, THE SAGE GATESHEAD, NE82JR, 54.9676771, -1.6019324, false
5462, THE LENCHFORD INN, WR66TB, 52.2732359, -2.2794503, false
5467, NOTTS COUNTY FC, NG23HJ, 52.9422431, -1.1361047, false
5482, STOURHEAD HOUSE AND GARDENS, BA126QD, 51.1050191, -2.3212325, false
5492, THE UNIVERSITY OF WALES,NEWPORT, NP183YG, 51.5720687, -2.944522, false
5496, WELLINGTON COLLEGE, RG457PU, 51.3640692, -0.8055664, false
5499, GOSFIELD HALL, CO91SF, 51.9377299, 0.5809639, false
5502, IVY HOUSE COUNTRY HOTEL, NR338HY, 52.4704097, 1.698521, false
5507, GEORGIAN HOUSE, LA11RS, 54.0456148, -2.8013188, false
5511, GEORGE HATTON ROOM, SK166DL, 53.4750688, -2.0871195, true
5515, NEW INN HOTEL, EX395TJ, 50.9974548, -4.399920799999999, false
5527, ERASMUS DARWIN HOUSE, WS137AD, 52.68535199999999, -1.8331209, false
5530, THE TORS HOTEL, EX356NA, 51.2306066, -3.827087499999999, false
5533, DOCKLANDS SAILING AND WATERSPORTS CENTRE, E143QS, 51.4943045, -0.0246517, false
5536, PLATEAU, E145ER, 51.5046219, -0.0162947, false
5542, WYCHWOOD GOLF CLUB, OX76QQ, 51.8893425, -1.5976085, false
5549, THE GEORGE HOTEL, PE293AB, 52.3309294, -0.1855027, false
5557, LANCASTER HOUSE HOTEL, LA14GJ, 54.0065043, -2.7883606, false
5562, RETFORD TOWN HALL, DN226DB, 53.3224052, -0.9426462000000001, false
5567, HALLGARTH MANOR HOTEL, DH61AB, 54.7867267, -1.4912373, false
5577, QUALITY HOTEL DUDLEY, DY14RN, 52.5125131, -2.0681203, false
5582, BROWSTON HALL, BROWSTON GREEN, NR319DW, 52.5569238, 1.6854797, false
5586, BRAXTED PARK ESTATE, CM83EN, 51.8059287, 0.6892210999999999, false
5594, WATERFRONT 1 & 2 , HOLIDAY INN, TW88JZ, 51.4856987, -0.3085777, true
5602, BEACHLANDS HOTEL, BS234NQ, 51.3332814, -2.9839316, false
5605, LITTLETON HOUSE, TW170QD, 51.4075546, -0.4635892, false
5610, THE STROOM RESTAURANT AND FUNCTION ROOMS, LS287RZ, 53.7925529, -1.6699533, false
5614, THE RED LION HOTEL, SP12AN, 51.06824899999999, -1.7931378, false
5620, DANISH CAMP, MK443QG, 52.1385576, -0.3735078, false
5629, EDINBURGH HOUSE, SY45DB, 52.8575437, -2.7219268, false
5639, THE BELL HOTEL, CT139EF, 51.2752072, 1.3420069, false
5648, DEER PARK HALL  AND CONFERENCE CENTRE, WR103DN, 52.0633806, -2.0783577, false
5651, CAMBERLEY HEATH GOLF CLUB, GU151JG, 51.3293742, -0.7242232, false
5654, HOTEL WROXHAM, NR128AJ, 52.71158759999999, 1.4091674, false
5662, BRIDGEHOUSE HOTEL, DT83AY, 50.8081073, -2.737782, false
5665, NOVOTEL LONDON EXCEL, E161AA, 51.50771289999999, 0.0228057, false
5669, PARLEY MANOR, BH236BB, 50.7749088, -1.8595862, false
5676, BOURNE HALL COUNTRY HOUSE HOTEL, PO376RR, 50.6204771, -1.1765619, false
5679, SKETCH, W1S2XD, 51.5129656, -0.1413748, false
5687, THE COACH HOUSE, DT117LN, 50.86384030000001, -2.1575287, false
5690, SOUTHOVER GRANGE, BN71TP, 50.8707921, 0.0071589, false
5697, CALDECOTT HALL GOLF AND LEISURE, NR319EY, 52.5546843, 1.6500964, false
5700, TRACY PARK GOLF AND COUNTRY CLUB, BS305RN, 51.445302, -2.4142958, false
5705, BATH RACECOURSE, BA19BU, 51.4185563, -2.4079133, false
5713, THE MILL HOTEL, CO101BD, 52.03869839999999, 0.7244657, false
5719, WEST MIDLANDS GOLF CLUB, B920LB, 52.4125352, -1.6862375, false
5722, PRINCE OF WALES THEATRE, W1D6AS, 51.5099988, -0.1317969, false
5727, GRAYTHWAITE MANOR, LA117JE, 54.189424, -2.9200504, false
5734, CHAK 89, CR43HG, 51.4084939, -0.1661763, false
5739, WATERHEAD HOTEL, LA218AJ, 54.3689258, -3.0631602, false
5743, LACE MARKET HOTEL LIMITED, NG11HE, 52.9511555, -1.1440836, false
5747, WROXALL ABBEY ESTATE, CV357NB, 52.3342778, -1.6769291, false
5751, EXETER COURT HOTEL, EX67UX, 50.6595378, -3.536556, false
5755, TRESTLE ARTS BASE, AL40JQ, 51.7471949, -0.2997156, false
5760, RAMPSBECK COUNTRY HOUSE HOTEL, CA110LP, 54.6018362, -2.8516961, false
5763, BEDRUTHAN STEPS HOTEL, TR84BU, 50.4694714, -5.028711599999999, false
5766, THRUMPTON HALL, NG110AX, 52.87596079999999, -1.243911, false
5774, RUDLOE ARMS, SN130PA, 51.4291442, -2.2270292, false
5784, FFOLKES ARMS HOTEL, PE316BJ, 52.79980579999999, 0.5444668, false
5788, UPPER COURT, GL207HY, 52.0284768, -2.0815905, false
5795, BADGEMORE PARK GOLF CLUB, RG94NR, 51.5415714, -0.9197604, false
5799, HOLIDAY INN LEICESTER, LE15LX, 52.63403779999999, -1.1410043, false
5805, ROYAL WELSH COLLEGE OF MUSIC AND DRAMA, CF103ER, 51.48564409999999, -3.1838562, false
5809, THE PLOUGH INN, SA196NP, 51.8926869, -3.984365199999999, false
5812, SHAW COUNTRY HOTEL, SN128EF, 51.3874286, -2.1581013, false
5815, NUMBER SIXTEEN, SW73EG, 51.4928951, -0.1752089, false
5820, THE MOUNTAIN GATE, SA183QN, 51.782092, -4.0186659, false
5824, GLAZIERS HALL LTD, SE19DD, 51.5067214, -0.0885712, false
5831, PLYMOUTH CITY, PL48AJ, 50.3739821, -4.1376198, false
5841, HARDWICK HALL, S445QJ, 53.1665648, -1.3099717, false
5844, CODNOR CASTLE INN, DE59RG, 53.0411629, -1.3728424, false
5848, THE CAWDOR HOTEL, SA196EN, 51.883027, -3.9924834, false
5851, BRIDGE HOUSE HOTEL AND RESTAURANT, RH29RP, 51.2547372, -0.1945852, false
5861, ENTERPRISE HOUSE, SY95AQ, 52.4921945, -2.9957997, false
5864, MOUNTAINS, TN118ND, 51.2181805, 0.2323222, false
5868, MANADON HOUSE, PL53UT, 50.4053919, -4.138512599999999, false
5873, FERNEHAM HALL, PO167DB, 50.8545272, -1.1769522, false
5877, GOOSEDALE, NG68UJ, 53.0344595, -1.1577657, false
5881, EUROPA GATWICK HOTEL, RH104ZR, 51.1166733, -0.1157821, true
5886, CUMBERLAND HOTEL, W1H7AL, 51.51362839999999, -0.1594495, false
5890, NORMANTON PARK HOTEL, LE158RP, 52.6460217, -0.6203465, false
5895, TUDOR LODGE HOTEL  (LOUNGE AND DINING ROOM ), HA52QN, 51.5827271, -0.4013113, false
5900, TAN HILL INN, DL116ED, 54.4555723, -2.1603463, false
5903, THE SARACENS HEAD HOTEL, NN126BX, 52.13217059999999, -0.9892213, false
5910, THE GEORGE IN RYE, TN317JT, 50.950905, 0.7336564999999999, false
5916, WHERRY HOTEL, NR323LN, 52.4760365, 1.7124131, false
5919, WALES MILLENNIUM CENTRE, CF105AL, 51.4647829, -3.1631909, false
5922, UPLANDS, HP156LB, 51.6576982, -0.7383884, false
5925, SANDBURN HALL, YO607RB, 54.0368473, -0.9782443999999999, false
5929, THE ROYAL INSTITUTION OF GREAT BRITAIN, W1S4BS, 51.5099452, -0.1425786, false
5933, VILLAGE HOTEL AND LEISURE CLUB, HU47DY, 53.7238456, -0.4116971, false
5942, THE BRIGANDS INN, SY209HJ, 52.697418, -3.6839664, false
5948, THE UNIVERSITY OF WINCHESTER, SO225HT, 51.0630049, -1.332933, false
5952, OLD RECTORY, EX226LA, 50.7943296, -4.3979541, false
5957, ROYAL OAK INN, LN118LZ, 53.33444770000001, 0.0382116, false
5962, SOHO HOTEL, W1D3BD, 51.5155574, -0.1341349, false
5966, DURKER ROODS HOTEL, HF94JA, 0.0, 0.0, false
5970, MIDDLE COMBE FARM, EX167QQ, 50.94409419999999, -3.4242854, false
5976, WELSH CRANNOG CENTRE, LD37TR, 51.9410718, -3.2655385, false
5980, THE CIVIC CENTRE, HA12UX, 51.5828963, -0.3362885, true
5985, PORTERS, SS26ER, 51.56022549999999, 0.7041647999999999, true
5988, THE GREAT BARN, TN174JG, 51.06222229999999, 0.6356748, false
5995, THE DRAGON HOTEL, SA15LS, 51.6216388, -3.9447045, false
5998, THE CROWN AND MITRE HOTEL, CA38HZ, 54.89437, -2.9368014, false
6002, HAYMARKET ROOM, NE992BN, 54.9677216, -1.6157867, false
6007, ANGEL & ROYAL HOTEL, NG316PN, 52.91300769999999, -0.6425582, false
6012, LOWER LODE INN, GL194RE, 51.9845858, -2.1779195, false
6016, THE OLD COURT HOUSE, NG138AL, 52.9523229, -0.9499213, false
6020, HMS GANNET, ME44TZ, 51.3942061, 0.5275466, false
6026, COMFORT HOTEL ENFIELD, EN28PX, 51.659789, -0.0972894, false
6030, THE GREAT ROOM, TW12NL, 51.44971469999999, -0.3159272, false
6037, BRITANNIA HOTEL, NG16BN, 52.9516953, -1.1541943, false
6042, THE SAXON MILL, CV345YN, 52.30094949999999, -1.5742838, false
6048, THE WATERSIDE INN, SL62AT, 51.50863630000001, -0.7001016, false
6052, RAMADA PLAZA, LL137YH, 53.0498261, -3.0119514, false
6057, THE UNIVERSITY OF WALES LAMPETER, SA487ED, 52.1138866, -4.075908399999999, false
6061, THE WOODHALL SPA HOTEL, LN106ST, 53.15257310000001, -0.2132012, false
6064, THE MEYNELL INGRAM ARMS, DE138RB, 52.8073849, -1.8089641, false
6071, THE BILDESTON CROWN, IP77EB, 52.1072742, 0.9090217999999999, false
6077, DODMOOR HOUSE, NN74TA, 52.2418182, -1.0858396, false
6083, THE OLD MILL HOTEL, YO253BQ, 54.098659, -0.4626664, false
6086, PEN Y CAE INN, SA91FA, 51.8112844, -3.6775772, false
6090, CLAYDON COUNTRY HOUSE HOTEL, IP60AR, 52.10568670000001, 1.1112477, false
6095, MANORBIER CASTLE, SA707SY, 51.645931, -4.7970125, false
6098, HOLMEWOOD HALL, PE73BZ, 52.4782853, -0.2480514, false
6105, CHOBHAM GOLF CLUB, GU212TZ, 51.3296799, -0.6149553999999999, false
6108, THE BLUEBELL CONFERENCE AND BANQUETING SUITE, S754LS, 53.5465789, -1.5362235, false
6113, SMITHS COURT HOTEL, CT92HL, 51.3906584, 1.3982675, false
6116, THE OLD VICTORIAN SCHOOL, GL51DY, 51.74463069999999, -2.2086357, false
6122, STANMER HOUSE, BN19QA, 50.8693025, -0.102157, false
6127, FINGLE BRIDGE INN, EX66PW, 50.6956283, -3.7804576, false
6132, KINGSTON BAGPUIZE HOUSE, OX135AX, 51.6780701, -1.4119301, false
6136, MILL HOUSE HOTEL, MK441NP, 52.2219293, -0.5250611, false
6139, FISHERMAN'S COT, EX168RW, 50.8579148, -3.5135574, false
6143, WOODLAND WATERS, NG323RT, 52.9799659, -0.5460876, false
6149, WYNNSTAY  ARMS HOTEL, LL138LP, 53.0452188, -2.9911541, false
6155, PLAS UCHAF, SY109LD, 52.81204779999999, -3.2231104, false
6160, TROXY, E10HX, 51.5128661, -0.0440114, false
6168, BRYN MEADOWS GOLF HOTEL SPA, CF827SN, 51.6344112, -3.2166254, false
6175, RED LION HOTEL, RG217NY, 51.2624627, -1.0846143, false
6180, THE PINES CALYX, CT156DZ, 51.1481218, 1.3833096, false
6183, GREAT MAYTHAM HALL, TN174NE, 51.046355, 0.6361434, false
6195, THE CHASE GOLF CLUB, ST195RN, 52.7256663, -2.0561192, false
6200, CONSALL HALL, ST90AG, 53.0360086, -2.0173175, false
6203, PARK INN, CM187BA, 51.7558551, 0.1261027, false
6213, CRESSBROOK HALL, SK178SY, 53.2533037, -1.7438406, false
6218, ROSLISTON  FORESTRY CENTRE, DE128JX, 52.7547142, -1.641426, false
6225, THE NOTTINGHAM PLAYHOUSE, NG15AL, 52.9536974, -1.1576383, false
6230, RANGERS HOUSE, SE108QX, 51.4734112, -0.0016365, false
6235, CIVIC CENTRE, FY67PU, 53.8509571, -2.9897569, false
6239, BESTWOOD LODGE HOTEL, NG58NE, 53.0065284, -1.1437789, false
6248, SIR A. BRUMWELL THOMAS ROOM, SK13XE, 53.4059744, -2.1584871, false
6251, THE CASTLE HOTEL, TA11NF, 51.0154951, -3.103711, false
6254, OAKLEY HALL, RG237EL, 51.2456346, -1.2020706, false
6258, NATIONAL MARITIME MUSEUM CORNWALL, TR113QY, 50.1515135, -5.061567699999999, false
6263, BEST WESTERN CUMBERLAND HOTEL, HA12EF, 51.5818713, -0.3320612, false
6274, DUDSBURY GOLF CLUB, BH228ST, 50.7855734, -1.9033733, false
6277, INSTITUTE OF CONTEMPORARY ARTS, SW1Y5AH, 51.5066303, -0.1303352, false
6281, HOLIDAY INN LONDON- CAMDEN LOCK, NW17BY, 51.540183, -0.1474476, false
6287, REDDITCH REGISTRATION OFFICE, B988ER, 52.3089367, -1.9380594, false
6291, KIDDERMINSTER REGISTRATION OFFICE, DY116RL, 52.3864311, -2.2600358, false
6296, THE BRADFORD ROOM, SL14UT, 51.51968410000001, -0.6141868, false
6299, FOLKESTONE RACECOURSE, CT214HX, 51.0941363, 1.0347532, false
6304, CHRIST'S HOSPITAL, RH130YP, 51.04426480000001, -0.3630122, false
6307, THE BEACHES HOTEL, LL197LG, 53.3444891, -3.4031889, false
6313, THE TAMBLING,WISE AND VIALLI SUITES, SW61HS, 51.481124, -0.1902966, false
6320, THE MILLENNIUM GLOUCESTER HOTEL, SW74LH, 51.4933807, -0.1833143, false
6327, THE MADISON HOTEL, SN34TL, 51.5777252, -1.732536, false
6337, CLIFF HOUSE, TQ88JQ, 50.2354863, -3.768472, false
6342, GRANGE HALL, NG122FB, 52.9454534, -1.0412563, false
6345, THE CONRAH HOTEL, SY234DF, 52.3693888, -4.0866083, false
6349, WOODHORN, NE639YF, 55.1879539, -1.5502514, false
6352, THE RIVERSIDE, OL128DP, 53.66594480000001, -2.1714791, false
6358, THE CORUS HOTEL- SOLIHULL, B904EB, 52.3898573, -1.8053765, false
6361, RED LION HOTEL, EX395TF, 50.9984623, -4.397720899999999, false
6366, DOLPHIN CENTRE, DL15RP, 54.5237069, -1.5541321, false
